,URL,Search term,Site title,Web snippet
70,https://startwhip.com.au/collections/startwhip-max-3-3l-combo-cream-chargers?srsltid=AfmBOorcfOIE7sjmyCDF9eBjXo8YYcUkuuOcRJKM4TB9R-9vZ_-sIwoK,"[('buy nitrous oxide', 0)]",3.3L TANK CREAM CHARGERS COMBO - Startwhip Max AU,Startwhip Max carries N2O professional cream chargers and whipped cream whippers based in Melbourne. The only place where can buy whipped cream chargers.
71,https://startwhip.com.au/collections/startwhip-max-3-3l-combo-cream-chargers?srsltid=AfmBOorh-8xqvbbEngEgUTltJmDkyB2PtRbyUPmGa9pOIDpAb6ndkwcd,"[('buy nitrous oxide canisters', 0)]",3.3L TANK CREAM CHARGERS COMBO - Startwhip Max AU,Startwhip Max carries N2O professional cream chargers and whipped cream whippers based in Melbourne. The only place where can buy whipped cream chargers.
72,https://theconversation.com/whipping-cream-canisters-have-many-uses-beyond-nangs-banning-them-isnt-necessary-164870,"[('nitrous oxide whipped cream', 0), ('nitrous oxide whipped cream', 1)]",Whipping cream canisters have many uses beyond 'nangs'. ...,27 July 2021 — 
73,https://tourfinder.au/experience/da-nang-city-tour-marble-mountain-lady-buddha-statue-private-tour-VIATOR-73792P81,"[('nang city', 0)]",Da Nang City Tour-Marble Mountain-Lady Buddha Statue ...,"TOUR PROGRAM : 8:00 or 13:00: Our guide pick you up at your hotel in Da Nang or Hoi An City. Then,Transfer to the Marble Mountains consisting of five marble ..."
74,https://vietnam.travel/places-to-go/central-vietnam/da-nang,"[('nang city', 0)]",Da Nang,... city. Set out in the early morning to take a serene walk up ... The Da Nang International Airport has several daily connections to major cities in Vietnam.
75,https://whipitgoodbrisbane.com.au/,"[('nangs delivery', 0), ('nangs delivery', 1), ('nangs delivery brisbane', 0), ('nangs delivery brisbane', 1), ('nangs brisbane', 0), ('nangs brisbane', 1), ('all night nangs', 1)]",Whip It Good Brisbane | Nangs Delivery Brisbane | Cream ...,DELIVERING TO THE GREATER BRISBANE (15-60 Minutes) · Sort by Default Order · Sort by Name · Sort by Price · Sort by Date · Sort by Popularity · Sort by Rating.
76,https://www.abc.net.au/news/2024-03-26/wa-toughest-nang-ban-nitrous-oxide-explained/103628656,"[('nangs perth', 1)]",WA has introduced what it says are the 'toughest' nang ...,25 Mar 2024 — 
77,https://www.alibaba.com/showroom/nitrous-oxide-canisters.html,"[('nitrous oxide canisters for sale', 0), ('nitrous oxide canisters for sale', 1)]",Nitrous Oxide Canisters(210+),"Nitrous Oxide Canisters(210+) ; $1,200.00 - $3,000.00. Min. order: 1 unit ; $14.80 - $26.80. Min. order: 128 pieces ; $17.00 - $19.00. Min. order: 2 pieces ; $9.00 ..."
78,https://www.aliexpress.com/w/wholesale-nitrous-cracker.html,"[('nang cracker', 0), ('nang cracker', 1)]",Nitrous Cracker - Home & Garden,Shop nitrous cracker at great deals online. The mini size and compact structure make this nitrous cracker easy to carry.
79,https://www.amazon.com.au/Nang-City-Wonders/dp/819054019X,"[('nang city', 0), ('nang city', 1)]",Da Nang: The City of Wonders - | 9788190540193,Da Nang: The City of Wonders ; Returns. Eligible for change of mind returns within 30 days of receipt ; Language. English ; Dimensions. 20.3 x 25.4 x 4.7 cm ; ISBN- ...
80,https://www.amazon.com.au/cream-chargers/s?k=cream+chargers,"[('cream chargers', 0), ('cream chargers', 1)]",Cream Chargers,"Professional Whipped Cream Dispenser - Stainless Steel Whipped Cream Maker, Large 500ml / 1 Pint Capacity Whip Canister, Includes 3 Various Stainless Culinary ..."
81,https://www.amazon.com.au/whipped-cream-chargers/s?k=whipped+cream+chargers,"[('whipped cream chargers', 0), ('whipped cream chargers', 1)]",Whipped Cream Chargers,"Professional Whipped Cream Dispenser - Stainless Steel Whipped Cream Maker, Large 500ml / 1 Pint Capacity Whip Canister, Includes 3 Various Stainless Culinary ..."
82,https://www.amazon.com/Creamright-Ultra-Purewhip-50-Pack-Whipped-Chargers/dp/B009OVU93E,"[('nitrous oxide whipped cream', 0), ('nitrous oxide whipped cream', 1)]",Ultra-Purewhip N2O Cream Chargers - 8g Premium ...,"Pure and Neutral: Each whipped cream charger tank is precisely filled with 100% nitrous oxide, ensuring a pure, taste-neutral output ideal for delicate whips, ..."
83,https://www.amazon.com/nitrous-canisters/s?k=nitrous+canisters,"[('nitrous oxide canister', 1), ('nitrous oxide canisters', 0), ('nitrous oxide canisters', 1)]",Nitrous Canisters,"... Nitrous Tank Whip Cream Charger, Nitrous Oxide Canister, Whip It N20 Whipped Cream Chargers, NO2 Nitrous Oxide Tank · 4.84.8 out of 5 stars. (20). $37.99$37.99."
84,https://www.amazon.com/nitrous-tank/s?k=nitrous+tank,"[('nitrous oxide tank', 0), ('nitrous oxide tank', 1)]",Nitrous Tank - Amazon.com,"NO2 cylinder Nitrous Oxide Tank 640g Whipped Cream Charger 1-Pack, 14.37 x 3.82 x 3.62, Blue, 640-Q1 · 50+ bought in past month. $39.99$39.99. FREE delivery Thu ..."
85,https://www.benchargers.com/,"[('nangs delivery brisbane', 0), ('nangs delivery brisbane', 1), ('nangs brisbane', 0), ('nangs brisbane', 1)]",Benchargers | Brisbane Cream Chargers | Premium Nangs ...,"Benchargers is Premium Nang Delivery Services in Brisbane, providing the best service and best product in the market. We deliver 50km within Brisbane area. For ..."
86,https://www.boc.com.au/shop/en/au/medical-nitrous-oxide,"[('nitrous oxide buy', 0), ('nitrous oxide buy', 1), ('where to buy nitrous oxide', 0), ('where to buy nitrous oxide', 1), ('nitrous oxide for sale', 0), ('nitrous oxide for sale', 1), ('nitrous oxide tank', 0), ('nitrous oxide tank', 1)]",Medical Nitrous Oxide - Gas,Nitrous Oxide >98%; Gas Grade: Medical Grade; Supply Mode: Cylinder; Brand ... Buy from BOC at any time; Keep track of deliveries; View & download invoices ...
87,https://www.creamcity.com.au/cream-city-perth-365-24-7-delivery-whipped-cream-chargers,"[('nangs perth', 1)]",Cream City Perth 24/7 Delivery Whipped Cream Chargers,PERTH NANG DELIVERY 24/7. Cream City offers the lowest prices on nangs. Cream City aims to complete all deliveries within 20 to 60 minutes.
88,https://www.creamify.com.au/creamify-brisbane-365-24-7-delivery-whipped-cream-chargers,"[('nangs delivery brisbane', 0), ('nangs delivery brisbane', 1), ('nangs brisbane', 0), ('nangs brisbane', 1)]",Creamify Brisbane 24/7 Delivery Whipped Cream Chargers,BRISBANE NANG DELIVERY 24/7. Creamify offers the lowest prices on nangs. Creamify aims to complete all deliveries within 20 to 60 minutes.
89,https://www.creamshop.com.au/brisbane-cream-shop-365-24-7-delivery-whipped-cream-chargers,"[('nangs delivery brisbane', 0), ('nangs delivery brisbane', 1), ('nangs brisbane', 0), ('nangs brisbane', 1)]",Brisbane Cream Shop 24/7 Delivery Whipped Cream Chargers,"BRISBANE NANG DELIVERY 24/7. Cream Shop aims to complete all deliveries within 20 to 60 minutes. Cream Shop is open 24 hours per day, 7 days per week."
90,https://www.creamwhip.com.au/nangs-and-nitrous-oxide/,"[('nangs cream chargers', 0), ('nangs cream chargers', 1)]",Nangs and Nitrous Oxide,"“Nangs” is a slang term in Australia for nitrous oxide whipped cream chargers. Specifically, nangs usually refer to whipped cream bulbs. They can also be ..."
91,https://www.dicksmith.com.au/da/buy/aussie-wholesale-store-cream-chargers-greatwhip-no2-nitrous-oxide-food-use-whipper-bulb-canisters-6783480266832-40009905569872/,"[('nitrous oxide canisters', 1)]",GreatWhip NO2 Nitrous Oxide Food Use Whipper Bulb ...,Discover offers on Cream Chargers - GreatWhip NO2 Nitrous Oxide Food Use Whipper Bulb Canisters at Dick Smith. Browse our extensive collection of Whisks ...
92,https://www.discountcream.co.uk/product-category/cream-chargers/n2o-tanks-cylinders/,"[('nitrous oxide buy', 0), ('nitrous oxide canisters for sale', 1)]",Buy Nitrous Oxide Tanks & Cylinders Online,"Buy Nitrous Oxide Tanks & Cylinders Online ... Nitrous oxide tanks & cylinders offer high-quality food-grade nitrous oxide, that offers a maximum efficiency cream ..."
93,https://www.drugrehab.com/addiction/drugs/inhalants/whippits/,"[('nitrous oxide whipped cream', 0), ('nitrous oxide whipped cream', 1)]",Whippits | 10 Facts to Know About Inhaling Nitrous Oxide,20 Mar 2023 — 
94,https://www.ebay.com.au/p/2211418854,"[('nang cracker', 0), ('nang cracker', 1)]",Cream Charger Cracker N2o Bulb Cracker Mini Whipped ...,Find many great new & used options and get the best deals for Cream Charger Cracker N2o Bulb Cracker Mini Whipped Aluminium Nang Cracker V2 at the best online
95,https://www.ezychargers.com.au/,"[('cream chargers', 0), ('cream chargers', 1), ('whipped cream chargers', 0), ('whipped cream chargers', 1)]",Ezychargers | Cream Chargers and Cream Whippers,Ezywhip Plus Cream Chargers N2O 8.5g 10 Pack x 36 (360 Bulbs) ... Get more bang for your buck with our superior 8.5g cream chargers filled with pure Nitrous Oxide ...
96,https://www.ezywhip.com.au/,"[('cream chargers', 0), ('cream chargers', 1), ('whipped cream chargers', 0), ('whipped cream chargers', 1)]",Ezywhip Cream Chargers and Cream Whippers,"Established in 2011, Ezywhip is Australia's biggest brand in cream chargers, cream whippers, soda chargers, soda syphons and related accessories."
97,https://www.ezywhip.com.au/australia-vic-victoria-melbourne-wholesale-whipped-cream-chargers-whippers,"[('whipped cream chargers', 1)]",Cream Chargers and Cream Whippers | Ezywhip Melbourne,Whipped cream is a mixture where a gas is suspended in a liquid where the liquid component is the heavy whipping cream. Traditionally whipped cream was made by ...
98,https://www.facebook.com/bestnangs/,"[('best nangs', 0), ('best nangs', 1)]",Best Nangs,"Vist the Best Nangs shop to purchase Nangs products. Cream whippers, cream canisters and more! Buy now and get immediate delivery in Melbourne suburbs! https:// ..."
99,https://www.facebook.com/nang.deliverybrisbane/,"[('nangs delivery brisbane', 0), ('nangs delivery brisbane', 1)]",Nang Delivery Brisbane,"Instant delivery Cream charger Nang delivery Brisbane. Lowest prices. Express/late night delivery! Posts. Photos. 󱜏. Lives in Brisbane, Queensland, ..."
100,https://www.facebook.com/perthnangs/,"[('nangs perth', 1)]",Perth Nangs | Perth WA,
101,https://www.foodanddrinkbusiness.com.au/directory/best-nangs,"[('best nangs', 0), ('best nangs', 1)]",Best Nangs,"Best Nangs is a cream whipping equipment supplier in Melbourne, Victoria. We supply and deliver all of the top cream charger and whipped cream dispenser brands."
102,https://www.ikegger.com/products/cream-charger-bulbs-10-pack,"[('buy nitrous oxide', 1), ('nitrous oxide for sale', 1)]",Cream Charger | Nitrous Oxide| 10 pack of 8g Bulbs,10 pack of cream charger bulbs (nitrous oxide). Great for dispensing cocktails and cold brew coffee.
103,https://www.ikegger.com/products/cream-charger-bulbs-10-pack?srsltid=AfmBOooLtP0lRZlvdevUUhf7WEOXoy-QkhXK4KhPy5bd1QQ1onhDkbM-,"[('buy nitrous oxide', 0)]",Cream Charger | Nitrous Oxide| 10 pack of 8g Bulbs,10 pack of cream charger bulbs (nitrous oxide). Great for dispensing cocktails and cold brew coffee.
104,https://www.ikegger.com/products/cream-charger-bulbs-10-pack?srsltid=AfmBOop4UHoVY6ieHNMZSrxOvfkx6Z2viCAjlbhlOOVIm5gponZ2Sl-u,"[('where to buy nitrous oxide', 1)]",Cream Charger | Nitrous Oxide| 10 pack of 8g Bulbs,10 pack of cream charger bulbs (nitrous oxide). Great for dispensing cocktails and cold brew coffee.
105,https://www.ikegger.com/products/cream-charger-bulbs-10-pack?srsltid=AfmBOopDpLPtj4OS-WbewWTtsMtzihMkFwAQbnK7iMBoOtXDiXRDZv7j,"[('nitrous oxide for sale', 0)]",Cream Charger | Nitrous Oxide| 10 pack of 8g Bulbs,8g Pure Nitrous Oxide | Nitro Coffee Etc | 10 Pack. Regular price $11.00 AUD. Regular price Sale price $11.00 AUD. Unit price / per. Sale Sold out. Tax included ...
106,https://www.ikegger.com/products/cream-charger-bulbs-10-pack?srsltid=AfmBOopIwKCqLV6MgbT_SULcLfjKtU7B0_RfIod09GskNwTOaS4ZfFrz,"[('where to buy nitrous oxide', 0)]",Cream Charger | Nitrous Oxide| 10 pack of 8g Bulbs,10 pack of cream charger bulbs (nitrous oxide). Great for dispensing cocktails and cold brew coffee.
107,https://www.marzwhip.com/product-page/640g-whipped-cream-charger,"[('nitrous oxide whipped cream', 1)]",PURE UNFLAVORED 1.1 LITER / 680 GRAMS ...,"Our tanks contain of food-grade nitrous oxide, producing 42.5 liters of whipped cream. Enjoy nourishing, fresh homemade whipped cream without additives. No ..."
108,https://www.melbournenangsdelivery.com.au/,"[('melbourne nang delivery', 0), ('melbourne nang delivery', 1), ('melbourne nangs delivery', 0), ('melbourne nangs delivery', 1), ('nangs buy melbourne', 0), ('nangs buy melbourne', 1), ('melbourne nangs', 0), ('melbourne nangs', 1), ('nangs delivery melbourne', 0), ('nangs delivery melbourne', 1), ('nangs melbourne', 0), ('nangs melbourne', 1)]",Melbourne Nangs Delivery | Tanks for $30 Open 24/7 ...,"Nangs Delivery Melbourne's is fastest cream chargers service open 24/7, with over 20+ five star reviews from happy customers. Order online with the most ..."
109,https://www.melbournenangsdelivery.com.au/product-page/premium-cream-charger-nang-cracker-dispenser-rubber-grip,"[('nang cracker', 0), ('nang cracker', 1)]",Nang Cracker | Melbourne Nangs Delivery,Superior quality aluminium Nang Cream Charger Cracker. Simple and easy Twist'n'Turn method to 'crack' open your nangs for instant whipped cream.
110,https://www.miamimagic.com.au/collections/culinary-grade-cylinders-n2o-nitrous-oxide-canisters,"[('nitrous oxide buy', 1), ('buy nitrous oxide canisters', 1), ('buy nitrous oxide', 1), ('nitrous oxide canisters for sale', 1), ('nitrous oxide for sale', 1), ('nitrous oxide canisters', 1)]",Buy Nitrous Oxide Canisters | Culinary Grade N2O ...,"Buy premium Nitrous Oxide canisters for culinary excellence at Miami Magic Australia. Explore our range of 580g, 615g, 640g, and 2050g N2O canisters."
111,https://www.miamimagic.com.au/collections/culinary-grade-cylinders-n2o-nitrous-oxide-canisters?srsltid=AfmBOoo2oan3TqoBhtgY1BqXgah6LWMXDPfxeFMU4qzof-qKnrLdsz-A,"[('nitrous oxide canister', 1)]",Buy Nitrous Oxide Canisters | Culinary Grade N2O Cylinders,"Buy premium Nitrous Oxide canisters for culinary excellence at Miami Magic Australia. Explore our range of 580g, 615g, 640g, and 2050g N2O canisters."
112,https://www.miamimagic.com.au/collections/culinary-grade-cylinders-n2o-nitrous-oxide-canisters?srsltid=AfmBOooKwFkHCCP8HHWxsKAtobnGlJ0R-VUYdzyNaoCs_sCG7nSBUTpB,"[('nitrous oxide canister', 0)]",Buy Nitrous Oxide Canisters | Culinary Grade N2O Cylinders,"Buy premium Nitrous Oxide canisters for culinary excellence at Miami Magic Australia. Explore our range of 580g, 615g, 640g, and 2050g N2O canisters."
113,https://www.miamimagic.com.au/collections/culinary-grade-cylinders-n2o-nitrous-oxide-canisters?srsltid=AfmBOoorKIgHi9Ir2wRrn81MJX5RoMoqRYUKn-mY6hsuYRuR9LrpCvIl,"[('nitrous oxide canisters for sale', 0)]",Buy Nitrous Oxide Canisters | Culinary Grade N2O ...,"Buy premium Nitrous Oxide canisters for culinary excellence at Miami Magic Australia. Explore our range of 580g, 615g, 640g, and 2050g N2O canisters."
114,https://www.miamimagic.com.au/collections/culinary-grade-cylinders-n2o-nitrous-oxide-canisters?srsltid=AfmBOop5ckJcGBX_G-hr2axqRsIiFD3ZZU4D2TcLElq2dFk7ged8TlnW,"[('where to buy nitrous oxide', 0)]",Buy Nitrous Oxide Canisters | Culinary Grade N2O ...,"Buy premium Nitrous Oxide canisters for culinary excellence at Miami Magic Australia. Explore our range of 580g, 615g, 640g, and 2050g N2O canisters."
115,https://www.miamimagic.com.au/collections/culinary-grade-cylinders-n2o-nitrous-oxide-canisters?srsltid=AfmBOop6QoVR4Bq6HJLJtxTJS4EwEq_XGmqlcFSNTQCikTGZMFRb6f5f,"[('nitrous oxide tank', 1)]",Buy Nitrous Oxide Canisters | Culinary Grade N2O Cylinders,"Buy premium Nitrous Oxide canisters for culinary excellence at Miami Magic Australia. Explore our range of 580g, 615g, 640g, and 2050g N2O canisters."
116,https://www.miamimagic.com.au/collections/culinary-grade-cylinders-n2o-nitrous-oxide-canisters?srsltid=AfmBOopS1vq9SDioR_r_QgBch5iCFIQoUkAWGw6jO9qxX4a7dXv26UCg,"[('nitrous oxide tank', 0)]",Buy Nitrous Oxide Canisters | Culinary Grade N2O Cylinders,"Buy premium Nitrous Oxide canisters for culinary excellence at Miami Magic Australia. Explore our range of 580g, 615g, 640g, and 2050g N2O canisters."
117,https://www.miamimagic.com.au/collections/culinary-grade-cylinders-n2o-nitrous-oxide-canisters?srsltid=AfmBOopVwvpbkzxp4kpMlHpuPdcmzX5P8dkRoHQYf5O_xMfMt5HH_YyH,"[('nitrous oxide for sale', 0)]",Buy Nitrous Oxide Canisters | Culinary Grade N2O Cylinders,"Buy premium Nitrous Oxide canisters for culinary excellence at Miami Magic Australia. Explore our range of 580g, 615g, 640g, and 2050g N2O canisters."
118,https://www.miamimagic.com.au/collections/culinary-grade-cylinders-n2o-nitrous-oxide-canisters?srsltid=AfmBOoq8nZqGrmT0R7sQ9YQjhs1PRCaaHT2cWvpNdFGvAYa62uEyUAfQ,"[('where to buy nitrous oxide', 1)]",Buy Nitrous Oxide Canisters | Culinary Grade N2O Cylinders,"Buy premium Nitrous Oxide canisters for culinary excellence at Miami Magic Australia. Explore our range of 580g, 615g, 640g, and 2050g N2O canisters."
119,https://www.miamimagic.com.au/collections/culinary-grade-cylinders-n2o-nitrous-oxide-canisters?srsltid=AfmBOorEdaxtbS4fVMpduD1MsPIeK4blq4dBr8r4n13YHLu_FG87ubza,"[('nitrous oxide buy', 0)]",Buy Nitrous Oxide Canisters | Culinary Grade N2O Cylinders,"Buy premium Nitrous Oxide canisters for culinary excellence at Miami Magic Australia. Explore our range of 580g, 615g, 640g, and 2050g N2O canisters."
120,https://www.miamimagic.com.au/collections/culinary-grade-cylinders-n2o-nitrous-oxide-canisters?srsltid=AfmBOorjVlfR8FRQEGOjqjzvdEXQ9H1H4opfS8N3wBrPTdD8gvCA7Tlf,"[('buy nitrous oxide canisters', 0)]",Buy Nitrous Oxide Canisters | Culinary Grade N2O Cylinders,"Buy premium Nitrous Oxide canisters for culinary excellence at Miami Magic Australia. Explore our range of 580g, 615g, 640g, and 2050g N2O canisters."
121,https://www.miamimagic.com.au/collections/culinary-grade-cylinders-n2o-nitrous-oxide-canisters?srsltid=AfmBOormB5Xi-FNedprqG0CeNBOtH6ZX8gRP0rV6IcNKA_VExKgJqWmr,"[('buy nitrous oxide', 0)]",Buy Nitrous Oxide Canisters | Culinary Grade N2O Cylinders,"Buy premium Nitrous Oxide canisters for culinary excellence at Miami Magic Australia. Explore our range of 580g, 615g, 640g, and 2050g N2O canisters."
122,https://www.miamimagic.com.au/collections/culinary-grade-cylinders-n2o-nitrous-oxide-canisters?srsltid=AfmBOorofD7mtiAH5yAtmDm_kQ8-bThP8z8XVhpXjMw9kbmDQO9y6tnZ,"[('nitrous oxide canisters', 0)]",Buy Nitrous Oxide Canisters | Culinary Grade N2O Cylinders,"Buy premium Nitrous Oxide canisters for culinary excellence at Miami Magic Australia. Explore our range of 580g, 615g, 640g, and 2050g N2O canisters."
123,https://www.mrcream.com.au/,"[('nangs delivery near me', 0), ('nangs delivery near me', 1), ('melbourne nang delivery', 0), ('melbourne nang delivery', 1), ('nangs buy', 0), ('nangs buy', 1), ('nangs near me', 0), ('nangs near me', 1), ('melbourne nangs delivery', 0), ('melbourne nangs delivery', 1), ('nang delivery', 0), ('nang delivery', 1), ('nangs buy melbourne', 0), ('nangs buy melbourne', 1), ('nangs delivery', 0), ('nangs delivery', 1), ('melbourne nangs', 0), ('melbourne nangs', 1), ('nangs delivery melbourne', 0), ('nangs delivery melbourne', 1), ('buy nangs', 0), ('buy nangs', 1), ('nangs melbourne', 0), ('nangs melbourne', 1), ('nangs cream chargers', 0), ('nangs cream chargers', 1), ('where to buy nangs', 0), ('where to buy nangs', 1), ('nang city', 0), ('nang city', 1)]",Mr Cream: Cream Chargers & Nang Delivery Melbourne,"The Leaders in Nang Delivery in Melbourne, Perth, and Sydney. Delivery Hours. Open 24/7 and Ready to Deliver. Are you looking to buy cream chargers nangs?"
124,https://www.mrnangs.com.au/,"[('nangs delivery near me', 0), ('nangs delivery near me', 1), ('nangs near me', 0), ('nangs near me', 1), ('nangs sydney', 0), ('nangs sydney', 1), ('nang delivery', 1), ('nangs delivery', 1), ('nang sydney', 0), ('nang sydney', 1)]",Nangs Delivery Sydney | 30 Min VIP Delivery | Real 24/7 ...,"Mr Nangs is Sydney's fastest nangs delivery and cream chargers store, with over 60+ five star reviews. Free delivery across Sydney in under 30 minutes ..."
125,https://www.mrnangs.com.au/post/crack-the-code-mastering-the-nang-cracker-with-mrnangs-com-au,"[('nang cracker', 0), ('nang cracker', 1)]",Crack the Code: Mastering the Nang Cracker with ...,22 Dec 2023 — 
126,https://www.nang-delivery.com.au/,"[('nangs sydney', 0), ('nangs sydney', 1), ('nang sydney', 0), ('nang sydney', 1)]",Nangs Delivery Sydney | Buy Nangs Online 24/7 | Fast Service,"Buy Nangs online in Sydney with 24/7 fast Nangs delivery service. From cream chargers, tanks to dispensers, get everything delivered to your home, call now."
127,https://www.nangdeliverybrisbane.com.au/,"[('nangs delivery near me', 0), ('nangs delivery near me', 1), ('nangs buy', 0), ('nangs buy', 1), ('nangs near me', 0), ('nangs near me', 1), ('nang delivery', 0), ('nang delivery', 1), ('nangs delivery', 0), ('nangs delivery', 1), ('buy nangs', 0), ('buy nangs', 1), ('nangs delivery brisbane', 0), ('where to buy nangs', 0), ('where to buy nangs', 1), ('nangs brisbane', 0), ('nangs brisbane', 1)]",Nang Delivery Brisbane | Cream Charger | 24/7 Home Delivery,"Nangs Delivery Brisbane is fastest cream chargers Home Delivery service open 24/7, with over 20+ five star reviews from happy customers."
128,https://www.nangdeliverybrisbane.com.au/faq,"[('nangs delivery brisbane', 0), ('nangs delivery brisbane', 1)]",FAQ | Nangs Delivery Brisbane | Cheap Cream Chargers,"Nang Delivery Brisbane offers fast delivery in Brisbane for nangs, a cream whipper, and all of your birthday party and baking needs. Our delivery times are ..."
129,https://www.nangdeliverybrisbane.com.au/product-page/premium-cream-charger-nang-cracker-dispenser-rubber-grip,"[('nang cracker', 0)]",Nang Cracker,Superior quality aluminium Nang Cream Charger Cracker. Simple and easy Twist'n'Turn method to 'crack' open your nangs for instant whipped cream.
130,https://www.nangdeliverybrisbane.com.au/shop,"[('nangs brisbane', 0), ('nangs brisbane', 1)]",Shop,"Nangs Delivery Brisbane is open 24 hours for instant nangs, cream whippers, cream chargers, whipped cream charger, tanks & bulbs."
131,https://www.nangdeliverygoldcoast.com.au/,"[('best nangs', 0), ('best nangs', 1), ('all night nangs', 0), ('all night nangs', 1)]",24 hours Nangs Gold Coast | Cream Chargers,"Nang Delivery Gold Coast is open 24 hours for instant nangs delivery, cream whippers, cream chargers, whipped cream chargers, tank canisters & bulbs."
132,https://www.nangdeliveryhobart.com.au/product-page/premium-cream-charger-nang-cracker-dispenser-rubber-grip,"[('nang cracker', 0), ('nang cracker', 1)]",Nang Cracker | Nang Delivery Hobart,
133,https://www.nangsdeliveryservice.com.au/product/nang-cream-charger-cracker/,"[('nang cracker', 0), ('nang cracker', 1)]",Cream Charger Cracker,Cream Charger Cracker. $28.00. Manufactured from high quality aluminium. Made to quickly deliver nitrous oxide for instant whipped cream.
134,https://www.nangsperth.com.au/,"[('nangs delivery near me', 0), ('nangs delivery near me', 1), ('nangs near me', 0), ('nangs near me', 1), ('nang delivery', 0), ('nang delivery', 1), ('cream chargers', 0), ('cream chargers', 1), ('nangs perth', 0), ('nangs delivery', 0), ('nangs delivery', 1), ('buy nangs', 0), ('buy nangs', 1), ('nangs cream chargers', 0), ('nangs cream chargers', 1), ('where to buy nangs', 0), ('where to buy nangs', 1), ('best nangs', 0), ('best nangs', 1)]",Perth Nangs | Perth Cream Chargers Delivery 24/7,"Nangs Perth is open 24 hours for instant nangs home delivery, cream whippers, tanks, N20 canister, cream chargers, whipped cream chargers, tanks & bulbs."
135,https://www.nangsperth.com.au/product-page/premium-cream-charger-nang-cracker-dispenser-rubber-grip,"[('nang cracker', 0), ('nang cracker', 1)]",Premium Cream Charger / Nang Cracker Dispenser,
136,https://www.nangwizard.net/,"[('nangs delivery near me', 0), ('nangs delivery near me', 1), ('melbourne nang delivery', 0), ('melbourne nang delivery', 1), ('nangs buy', 0), ('nangs buy', 1), ('nangs near me', 0), ('nangs near me', 1), ('melbourne nangs delivery', 0), ('melbourne nangs delivery', 1), ('nang delivery', 0), ('nang delivery', 1), ('nangs buy melbourne', 0), ('nangs delivery', 0), ('nangs delivery', 1), ('melbourne nangs', 0), ('melbourne nangs', 1), ('nangs delivery melbourne', 0), ('nangs delivery melbourne', 1), ('buy nangs', 0), ('buy nangs', 1), ('nangs melbourne', 0), ('nangs melbourne', 1), ('where to buy nangs', 0), ('where to buy nangs', 1), ('best nangs', 0), ('best nangs', 1), ('nang city', 0), ('nang city', 1)]","Nang Delivery Melbourne, Cream Chargers (Super Fast ...","NangWizard is Melbourne's fastest nang delivery service, with over 90+ five star reviews from happy customers. Order online with the Wizard today!"
137,https://www.nangwizard.net/nangs-delivery-brisbane/,"[('nangs delivery brisbane', 0), ('nangs delivery brisbane', 1), ('nangs brisbane', 0), ('nangs brisbane', 1)]",Brisbane - Nangs & Cream Chargers Delivery,Looking for top-quality whipped cream chargers to order online in Brisbane and the nearby area? NangWizard is the company for you.
138,https://www.nangwizard.net/nangs-delivery-geelong/,"[('all night nangs', 0), ('all night nangs', 1)]",Geelong - Nangs & Cream Chargers Delivery,"Whipped cream lovers in the Geelong area rejoice! NangWizard offers top quality chargers and accessories, with rapid delivery at competitive prices."
