,URL,Search term,Site title,Web snippet
0,http://sydneynang24h.com.au/,"[('nang sydney', 0), ('nang sydney', 1)]",Nang Sydney | Cream Chargers | 24H Free Delivery,"Experience swift Nang delivery in Sydney! Elevate your moments with premium cream chargers, available 24/7. Free delivery within 24 hours!"
1,https://adf.org.au/drug-facts/nitrous-oxide/,"[('nitrous oxide canister', 0), ('nitrous oxide canister', 1), ('nitrous oxide canisters', 0), ('nitrous oxide canisters', 1)]",Nitrous oxide,"Nitrous oxide is a colourless gas found in pressurised metal canisters, commonly taken from whipped cream chargers.1. Other names. Laughing gas, nitro, N2O ..."
2,https://allnightnangs.com.au/,"[('all night nangs', 0)]",all night nangs,All night nangs cream charger delivery Ballarat Bendigo Geelong.
3,https://au.linkedin.com/company/nangs-delivery,"[('nang city', 1)]",Nangs Delivery,If you have a cake emergency in your nang city. We have the best nang stuff. We can deliver nang wizard fast direct to your door. You can be Mr Cream when ...
4,https://aussiechargers.com/,"[('nangs perth', 0), ('nangs perth', 1)]",Aussie Chargers - 24/7 Perth Cream Charger Nang Delivery,Aussie Chargers is Perth's fastest cream charger delivery service. We aim to complete all deliveries within 20-90 minutes. We accept cash or card payments.
5,https://bestnangs.com.au/,"[('nangs buy melbourne', 0), ('nangs buy melbourne', 1), ('best nangs', 0)]",Best Nangs Delivery Melbourne,Australia's leading supplier of cream chargers & dispensers. Fast nang delivery Australia wide & immediate nangs delivery in Melbourne.
6,https://bouncemagazine.co.uk/all-night-nangs-melbournes-secret-to-great-parties/,"[('all night nangs', 1)]",All-Night Nangs: Melbourne's Secret to Great Parties,"Nangs, also known as nitrogen cream chargers, are small metal canisters filled with nitrous oxide (N₂O). They are designed to be used with a ..."
7,https://cake-emergency.com/,"[('nangs buy melbourne', 1)]",#1 Melbounre nangs delivery service. Get nangs & cream ...,"Melbourne's leading whipped cream charger business, started since 2018. We are the expert of kitchen supplies. We offer the fastest delivery service and the ..."
8,https://cloud9australia.com.au/products/copy-of-mosa-cream-chargers-please-pick-size,"[('nitrous oxide buy', 0), ('nitrous oxide buy', 1), ('buy nitrous oxide canisters', 0), ('buy nitrous oxide canisters', 1)]",CREAM CHARGERS - SUPREME 50PK,50 x 8.2g SupremeWhip cream chargers. Our own branded nitrous oxide whipped cream chargers are manufactured and certified 100% pure nitrous oxide (N2O) in ...
9,https://creamchargers.net.au/nitrous-oxide,"[('where to buy nitrous oxide', 1), ('buy nitrous oxide', 0), ('buy nitrous oxide', 1), ('nitrous oxide canisters for sale', 0), ('nitrous oxide canisters for sale', 1)]",Nitrous Oxide Cylinders For Sale Australia - Cream Chargers,Buy Nitrous Oxide Tanks now and get them fast delivered express to your door. We also stock other products such as N2O chargers and dispensers. All nitrous ...
10,https://creamchargersydney.com.au/,"[('nangs sydney', 0), ('nangs sydney', 1), ('nang sydney', 0), ('nang sydney', 1)]",Nangs Delivery in Sydney - Free Delivery Cream Chargers 24/7,Nangs Delivery In Sydney is a renowned courier that specializes in providing Quality bakery accessories such as whipped cream dispensers and cream chargers.
11,https://creamchargerwarehouse.com.au/nitrous-oxide,"[('nitrous oxide buy', 0), ('nitrous oxide buy', 1), ('where to buy nitrous oxide', 0), ('where to buy nitrous oxide', 1), ('nitrous oxide canister', 0), ('nitrous oxide canister', 1), ('buy nitrous oxide canisters', 0), ('buy nitrous oxide canisters', 1), ('buy nitrous oxide', 0), ('buy nitrous oxide', 1), ('nitrous oxide canisters for sale', 0), ('nitrous oxide canisters for sale', 1), ('nitrous oxide for sale', 0), ('nitrous oxide for sale', 1), ('nitrous oxide canisters', 0), ('nitrous oxide canisters', 1), ('nitrous oxide tank', 0), ('nitrous oxide tank', 1)]",Buy Nitrous Oxide Canisters | N2O Gas Tanks & Cylinders ...,Buy Nitrous Oxide Canisters · N2O Gas Tanks & Canisters 580g | Food Grade Nitrous Oxide For Sale · NitrousWhip 2100g N2O Canister | Cream Charger Tank.
12,https://creamwizard.com.au/,"[('nangs perth', 0), ('nangs perth', 1)]","Cream Wizard: Nang Delivery Perth, Cream Chargers (Fast ...","Perth is a big city, but our nang delivery service makes it possible for you to get high-quality cream chargers in less than an hour at an affordable price! If ..."
13,https://docs.google.com/document/d/1bhkaeyGnu6bdaLaisbJsbOyCTIBD5vr27XeAr7KyONM/edit?usp=sharing,"[('nang city', 0), ('nang city', 1)]",Nang City Delivery: Bringing Melbourne's Cream Chargers ...,From Day to Night: Nang City Melbourne Opening Hours for Late-Night Cravings. Nang City Melbourne is a popular food establishment known for its delectable ...
14,https://en.wikipedia.org/wiki/Whipped-cream_charger,"[('whipped cream chargers', 0), ('whipped cream chargers', 1), ('nitrous oxide whipped cream', 0), ('nitrous oxide whipped cream', 1)]",Whipped-cream charger,A whipped cream charger is a steel cylinder or cartridge filled with nitrous oxide (N2O) that is used as a whipping agent in a whipped cream dispenser.
15,https://exoticwhip.com/shop/640g-cream-chargers/?srsltid=AfmBOoqR07jKK0VIZcOfKzZ0UfNJJjMYkZr7c0XMhHmTu4WUC-dU9w28,"[('nitrous oxide whipped cream', 1)]",Exotic Whip Cream Chargers | Original Flavorless N2O Tanks,ExoticWhip Cream Chargers – 2000G (2KG) – Original Nitrous Tank. Rated 4.91 out of 5. $94.99 – $449.99.
16,https://exoticwhip.com/shop/640g-cream-chargers/?srsltid=AfmBOoqbCvdLoORc9OwN3FF6D2Ug9CPreV4l7fw4399cU6aAfO74G9TH,"[('nitrous oxide whipped cream', 0)]",Exotic Whip Cream Chargers | Original Flavorless N2O Tanks,ExoticWhip Cream Chargers – 2000G (2KG) – Original Nitrous Tank. Rated 4.91 out of 5. $94.99 – $449.99.
17,https://gascylindersource.com/product-category/nitrous-oxide-cylinders/?srsltid=AfmBOoo2OgVqekWJ6uCFWqVXFvM7ib0G-oQc393MG_p93ID-XTQ3KBYQ,"[('nitrous oxide tank', 0)]",Nitrous Oxide Cylinders & Tanks,Nitrous oxide cylinders and tanks available now. View all current inventory and place your online order today!
18,https://gascylindersource.com/product-category/nitrous-oxide-cylinders/?srsltid=AfmBOorErZwydVPlNixAWvW6syvIbZUyWi27fyCOUrQP9yyNONRyEusZ,"[('nitrous oxide tank', 1)]",Nitrous Oxide Cylinders & Tanks,Nitrous oxide cylinders and tanks available now. View all current inventory and place your online order today!
19,https://kingwhip.com.au/,"[('melbourne nang delivery', 0), ('melbourne nang delivery', 1), ('melbourne nangs delivery', 0), ('melbourne nangs delivery', 1), ('nangs buy melbourne', 0), ('nangs buy melbourne', 1), ('melbourne nangs', 0), ('melbourne nangs', 1), ('nangs delivery melbourne', 0), ('nangs delivery melbourne', 1), ('nangs melbourne', 0), ('nangs melbourne', 1)]","Nang Delivery Melbourne, Cream Chargers – Fastest & Most ...","King Whip offers the fastest nang delivery in Melbourne, top-quality cream chargers, and has earned over 200 five-star reviews from satisfied customers."
20,https://kingwhip.com.au/product-category/bestwhip-cream-charger/,"[('best nangs', 0), ('best nangs', 1)]",Best Whip Cream Chargers | Nang Whipper,"Buy Best Whip Cream Chargers, Whipped Cream Dispensers, and Nang Whippers via King Whip's Nangs Delivery Melbourne services. Upgrade to Best Whip now!"
21,https://kingwhip.com.au/shop/,"[('nangs buy', 0), ('nangs buy', 1), ('nangs buy melbourne', 0), ('nangs buy melbourne', 1), ('nangs cream chargers', 0), ('nangs cream chargers', 1), ('where to buy nangs', 0), ('where to buy nangs', 1)]",Quick Nangs Delivery Melbourne | Buy Cream Chargers ...,"Fast nangs delivery in Melbourne! Get cream chargers, nang tanks, and cream dispensers from King Whip with delivery in under one hour."
22,https://mrnang.com.au/,"[('melbourne nang delivery', 0), ('melbourne nang delivery', 1), ('nangs buy', 0), ('nangs buy', 1), ('nangs near me', 0), ('nangs near me', 1), ('melbourne nangs delivery', 0), ('melbourne nangs delivery', 1), ('nang delivery', 0), ('nang delivery', 1), ('nangs buy melbourne', 0), ('nangs buy melbourne', 1), ('nangs delivery', 0), ('nangs delivery', 1), ('melbourne nangs', 0), ('melbourne nangs', 1), ('nangs delivery melbourne', 0), ('nangs delivery melbourne', 1), ('nangs melbourne', 0), ('nangs melbourne', 1)]",Reliable & Fastest Nang Delivery in Melbourne,"We offer delivery service throughout Melbourne, including the southeast, eastern, western, and northern suburbs. Our average delivery time is between 20 and 60 ..."
23,https://myblitz.co.nz/products/cracker-21-99,"[('nang cracker', 1)]",Cracker $21.99,"Introducing the Cracker $21.99, your passport to a world of whipped perfection. This cream charger dispenser isn't just a tool; it's an expression of style, ..."
24,https://nang-a-roo.com.au/,"[('nangs perth', 0), ('nangs perth', 1)]",Nang-a-roo: Nang Delivery Perth - Cream Charger Delivery ...,"With Nang-A-Roo, you're guaranteed top-notch nang and cream charger delivery service in Perth. Serving a wide range of suburbs and surrounding areas, we are ..."
25,https://nangchef.com/,"[('all night nangs', 0), ('all night nangs', 1)]",All Night Nangs & Cream Chargers Delivery Melbourne ...,All Night Nangs & Cream chargers service delivery in Melbourne with average delivery time of only 27 minutes. Order online with Nangchef now!!
26,https://nangcity.com.au/,"[('melbourne nang delivery', 0), ('melbourne nang delivery', 1), ('melbourne nangs delivery', 0), ('melbourne nangs delivery', 1), ('melbourne nangs', 0), ('melbourne nangs', 1), ('nangs delivery melbourne', 1), ('nangs melbourne', 0), ('nangs melbourne', 1), ('nang city', 0), ('all night nangs', 1)]",Nang City: Late night party supplies delivery in Melbourne ...,"Nang City is a late night party goods delivery service in Melbourne, Australia. We sell cylindrical note holders, whipped cream chargers, beer pong balls ..."
27,https://nangdeliverysydney.com.au/,"[('nangs delivery near me', 1), ('nang sydney', 1)]",Nang Delivery Sydney | Free Delivery 24/7 near by | 100 for 90$,"Nang Delivery Sydney offers late night in Sydney for nangs, cream whippers, cream chargers, whipped cream charger and cream bulbs."
28,https://nangme.com.au/,"[('all night nangs', 0), ('all night nangs', 1)]",NangMe | Cheapest Mosa Cream Chargers & Kitchen Supplies,Nangme is Melbourne's most trusted Nang delivery service provider which serves all-day and night delivery services in Melbourne and Geelong. About Nangme.
29,https://nangs.net.au/,"[('nangs buy', 1), ('buy nangs', 1), ('nangs cream chargers', 0), ('nangs cream chargers', 1), ('where to buy nangs', 0), ('where to buy nangs', 1)]",Nangs | The Best Nang Delivery & Nangs Delivery Service,Cream Chargers & cream whipping equipment delivered to your door. Best Prices on Nangs! Buy NANGS.
30,https://nangsbrisbane.com/,"[('nangs delivery brisbane', 0), ('nangs delivery brisbane', 1), ('nangs brisbane', 0), ('nangs brisbane', 1)]",nangsbrisbane.com,
31,https://nangsdelivery.com.au/,"[('nangs buy', 0), ('nangs buy', 1), ('nangs buy melbourne', 0), ('nangs buy melbourne', 1), ('buy nangs', 0), ('buy nangs', 1), ('where to buy nangs', 0), ('where to buy nangs', 1), ('all night nangs', 0), ('all night nangs', 1)]",Nangs Delivery,24/7 Nangs Delivery | Nang Delivery | Chargers Delivered To Your Door. Buy Nang & Nanganators Delivered Fast! Cheap Prices & Great Service!
32,https://nangsdelivery.com/,"[('nangs delivery near me', 0), ('nangs delivery near me', 1), ('melbourne nang delivery', 0), ('melbourne nang delivery', 1), ('nangs near me', 0), ('nangs near me', 1), ('melbourne nangs delivery', 0), ('melbourne nangs delivery', 1), ('nang delivery', 0), ('nangs delivery', 0), ('melbourne nangs', 0), ('melbourne nangs', 1), ('nangs delivery melbourne', 0), ('nangs delivery melbourne', 1), ('nangs melbourne', 0), ('nangs melbourne', 1), ('nangs delivery brisbane', 0), ('nangs delivery brisbane', 1), ('nangs brisbane', 0), ('nangs brisbane', 1), ('nang city', 1)]","Nang Delivery Melbourne, Sydney & Brisbane Open 24/7","We Are Open & Delivering NANGS Now. 20 Minutes Nang Delivery to your door Within 20km across Melbourne, Sydney, & Brisbane."
33,https://nangsdelivery.com/sydney/,"[('nangs sydney', 0), ('nangs sydney', 1), ('nang sydney', 0), ('nang sydney', 1)]",Nangs Delivery Sydney $70 $3.3L Open 24/7,"Fast, reliable Nangs delivery in Sydney, 24/7! Get whipped cream chargers delivered to your door. Order now for quick service."
34,https://nangsdeliverygoldcoast.com.au/product-category/dispensers-crackers/,"[('nang cracker', 0), ('nang cracker', 1)]",Dispensers And Crackers - Nangs Delivery Gold Coast,
35,https://nangsman.com/,"[('nangs delivery near me', 0), ('nangs delivery near me', 1), ('nangs near me', 0), ('nangs near me', 1), ('nangs sydney', 0), ('nangs sydney', 1), ('nang sydney', 0), ('nang sydney', 1)]",Nang Delivery Sydney | 3.3L tank for $100 | Nangs near me ...,Sydney's premier choice for nangs delivery. Our average cream chargers delivery time is 25 minutes. We can price beat any competitors. No hidden delivery ...
36,https://nangsqueen.com.au/,"[('melbourne nang delivery', 1), ('nangs buy', 0), ('nangs buy', 1), ('melbourne nangs delivery', 0), ('melbourne nangs delivery', 1), ('nangs sydney', 0), ('nangs sydney', 1), ('nang delivery', 0), ('nang delivery', 1), ('nangs buy melbourne', 0), ('nangs buy melbourne', 1), ('nangs delivery', 0), ('nangs delivery', 1), ('melbourne nangs', 0), ('melbourne nangs', 1), ('nang sydney', 0), ('nang sydney', 1), ('nangs delivery melbourne', 0), ('nangs delivery melbourne', 1), ('buy nangs', 0), ('buy nangs', 1), ('nangs melbourne', 1)]",24/7 Nangs Delivery Melbourne Sydney | Cream Chargers,"The most trusted Nangs Delivery. Get nangs, cream chargers delivered across Melbourne and Sydney in Australia in 25 minutes, 24/7. Call us now: 0449877707."
37,https://nangsqueen.com.au/product/best-buy-fancy-whip-mint-615g/,"[('best nangs', 0), ('best nangs', 1)]",Best Buy Fancy Whip Mint 615G,"Best Buy Fancy Whip Mint 615G at Nangs Queen Fast Delivery! Open 24/7, deliver in 25 minutes across Sydney and Melbourne. Call us:0449877707r."
38,https://nangstar.com.au/,"[('melbourne nang delivery', 0), ('melbourne nang delivery', 1), ('melbourne nangs delivery', 1), ('melbourne nangs', 0), ('melbourne nangs', 1), ('nangs delivery melbourne', 0), ('nangs delivery melbourne', 1), ('nangs melbourne', 0), ('nangs melbourne', 1)]",Nangstar Cream Chargers Delivery Nangs ...,"Experience Melbourne's premier cream chargers delivery service with NangStar. We're the #1 choice for fast, reliable, and professional nangs delivery."
39,https://nangstuff.com.au/,"[('nangs buy', 0), ('nangs buy melbourne', 1), ('nangs delivery melbourne', 0), ('nangs delivery melbourne', 1), ('buy nangs', 0), ('buy nangs', 1), ('nangs melbourne', 1), ('nang city', 0), ('nang city', 1)]",Nang Delivery Melbourne 24/7 | Buy Cream Chargers,Get Fastest Nang Delivery Melbourne with premium cream chargers from NangStuff. Enjoy quick and reliable Nangs Delivery in 25 Minutes.
40,https://nangstuff.com.au/?srsltid=AfmBOopAh9UrGOxioblIS457J29tO0W6_1w2pjbYPRBcs9OPp9KfYUSG,"[('melbourne nangs delivery', 1)]",Nang Delivery Melbourne 24/7 | Buy Cream Chargers,Get Fastest Nang Delivery Melbourne with premium cream chargers from NangStuff. Enjoy quick and reliable Nangs Delivery in 25 Minutes.
41,https://nangstuff.com.au/?srsltid=AfmBOopFX6HZItu7G9ZEblOD49cYPz14rLTfU3GXj18Jt_pMtY4KUKQi,"[('nangs melbourne', 0)]",Nang Delivery Melbourne 24/7 | Buy Cream Chargers,Get Fastest Nang Delivery Melbourne with premium cream chargers from NangStuff. Enjoy quick and reliable Nangs Delivery in 25 Minutes.
42,https://nangstuff.com.au/?srsltid=AfmBOopWo1pK5J-HMs5h1fCIpMBooDHovsogeHydbqp0InfLaRfpeaID,"[('nangs buy melbourne', 0)]",Nang Delivery Melbourne 24/7 | Buy Cream ...,Get Fastest Nang Delivery Melbourne with premium cream chargers from NangStuff. Enjoy quick and reliable Nangs Delivery in 25 Minutes.
43,https://nangstuff.com.au/?srsltid=AfmBOophIr_ltpefjnlvZKHXV13Ehxq86v4aNPzyZMJN2N4q2SaH2x8H,"[('melbourne nangs', 0)]",Nang Delivery Melbourne 24/7 | Buy Cream Chargers,Get Fastest Nang Delivery Melbourne with premium cream chargers from NangStuff. Enjoy quick and reliable Nangs Delivery in 25 Minutes.
44,https://nangstuff.com.au/?srsltid=AfmBOopxVAno4hHR32-fDv_SoEdMxPAb3lHgZDwTaDTU2j0gbCGaOhIL,"[('melbourne nangs', 1)]",Nang Delivery Melbourne 24/7 | Buy Cream Chargers,Get Fastest Nang Delivery Melbourne with premium cream chargers from NangStuff. Enjoy quick and reliable Nangs Delivery in 25 Minutes.
45,https://nangstuff.com.au/?srsltid=AfmBOoqTnW01voTSxnwrkTrt6EbOuh9EI1BzWDdJpuiASYIyDaf4A629,"[('melbourne nang delivery', 0)]",Nang Delivery Melbourne 24/7 | Buy Cream Chargers,Get Fastest Nang Delivery Melbourne with premium cream chargers from NangStuff. Enjoy quick and reliable Nangs Delivery in 25 Minutes.
46,https://nangstuff.com.au/?srsltid=AfmBOorFKICQikwznukRAAzjIYoAECm98IUmsPvqciHBtlgB59dzZkCq,"[('melbourne nangs delivery', 0)]",Nang Delivery Melbourne 24/7 | Buy Cream Chargers,Get Fastest Nang Delivery Melbourne with premium cream chargers from NangStuff. Enjoy quick and reliable Nangs Delivery in 25 Minutes.
47,https://nangstuff.com.au/?srsltid=AfmBOorLRI44yiwxgkW2ZcJbIaliwk-A8gkL1lyl-_4tU8Ife2Qk2dtK,"[('nangs buy', 1)]",Nang Delivery Melbourne 24/7 | Buy Cream Chargers,Get Fastest Nang Delivery Melbourne with premium cream chargers from NangStuff. Enjoy quick and reliable Nangs Delivery in 25 Minutes.
48,https://nangstuff.com.au/?srsltid=AfmBOortRyJ9SAmJw9LFnqwy8-ADGLYaLeIytsqqGdC5TyIkEQZwW0dl,"[('melbourne nang delivery', 1)]",Nang Delivery Melbourne 24/7 | Buy Cream Chargers,Get Fastest Nang Delivery Melbourne with premium cream chargers from NangStuff. Enjoy quick and reliable Nangs Delivery in 25 Minutes.
49,https://nangsydney.com/,"[('nangs delivery near me', 0), ('nangs delivery near me', 1), ('nangs near me', 0), ('nangs near me', 1), ('nangs sydney', 0), ('nang delivery', 0), ('nang delivery', 1), ('nangs delivery', 0), ('nangs delivery', 1), ('nang sydney', 0), ('nang city', 0), ('nang city', 1)]",Nangs Delivery Sydney | Fastest Delivery 24/7 | 3.3L For $50,"NANGS DELIVERY SYDNEY OPEN 24/7​​ Most trusted Nangs Delivery provider in Sydney. Get whippers, cream chargers, tanks delivered across Sydney in 15-40 Mins."
50,https://nangsydney.com/shop/,"[('nangs sydney', 0), ('nangs sydney', 1)]",Nangs Sydney | Cream Chargers Free Delivery | Open 24/7,"24/7 Nangs Delivery Sydney: cheapest & fastest for nangs, tanks, cream chargers. Get your delivery in 15-40 Mins. Free delivery for nangs in sydney."
51,https://nangtank.com/,"[('nangs sydney', 0), ('nangs sydney', 1)]",Nangs Delivery Sydney | Cream Chargers Open 24/7 | 15-30 ...,"Sydney's top choice for nangs delivery 24/7. Free & Fast delivery of whippers, cream chargers, and tanks within 30 mins. we guarantee the fastest delivery and ..."
52,https://nitrouswhip.com.au/,"[('nitrous oxide whipped cream', 0), ('nitrous oxide whipped cream', 1)]",Whipped Cream Chargers & Cream Whippers Australia ...,"Our whipped cream chargers N2O nitrous oxide are perfect for whipped creams, sauces, mousses and other pastes. Turn them into light, fluffy fancy designs. Make ..."
53,https://nitrouswhip.com.au/nitrous-oxide-canisters-tanks-cylinders,"[('nitrous oxide buy', 0), ('nitrous oxide buy', 1), ('where to buy nitrous oxide', 0), ('where to buy nitrous oxide', 1), ('nitrous oxide canister', 1), ('buy nitrous oxide canisters', 0), ('buy nitrous oxide canisters', 1), ('buy nitrous oxide', 1), ('nitrous oxide canisters for sale', 0), ('nitrous oxide canisters for sale', 1), ('nitrous oxide for sale', 0), ('nitrous oxide for sale', 1), ('nitrous oxide canisters', 0), ('nitrous oxide canisters', 1), ('nitrous oxide tank', 0), ('nitrous oxide tank', 1)]",Nitrous Oxide Cylinders For Sale | Buy Cheap ...,The nitrous oxide cream chargers sold on this site are for the preparation of food products. Whip cream chargers are used to whip various food products such as ...
54,https://offyatree.com.au/collections/cream-chargers,"[('whipped cream chargers', 0), ('whipped cream chargers', 1)]",Buy Whipped Cream Dispensers and Chargers,"Buy a high-quality whipped cream charger and dispenser online in Australia for home use. You can prepare delicious cold ingredients such as whipped creams, ..."
55,https://open.spotify.com/episode/4y4h4yHkjCbU2U151Rzh1R,"[('nangs delivery brisbane', 1)]",Nangs Delivery Brisbane,"... Nangs Delivery Brisbane and get it delivered to your doorsteps. Official Website: https://www.nangsdelivery.com/ Nangs Delivery Address: Melbourne, AUS ..."
56,https://perthchargers.com.au/,"[('nangs perth', 0), ('nangs perth', 1), ('where to buy nangs', 0), ('where to buy nangs', 1)]",Perth Nangs - Cream Chargers Express Perth 24/7 Delivery,"PerthChargers is Perth's best Cream Charger Delivery 24/7 Service. Top supplier of cream chargers nangs in Perth, WA. Open 24 Hours, 365 Days."
57,https://perthcreamchargers.com/,"[('nang delivery', 0), ('nang delivery', 1), ('nangs perth', 0), ('nangs perth', 1)]",Perth Cream Chargers | Nang Delivery 24/7 Perth Cream ...,"$499.99. SHOP NOW. Located in Perth, Western Australia. We offer true 24/7 instant express cream charger delivery up to 100km from Perth's CBD. We are open 365 ..."
58,https://perthnangs.com/,"[('nangs perth', 0), ('nangs perth', 1)]",Perth Nangs | Perth Cream Charger Nang Delivery 24/7 ...,Perth Nangs open & delivering cream chargers & nangs to your door in Perth within 45 minutes at any time of the day or night with our 24/7 service.
59,https://ssesgas.com/,"[('nangs cream chargers', 0), ('nangs cream chargers', 1)]",Cream Chargers | Nos Canisters | SSES Delivery,"We offers fastest home delivery service in Sydney for Nangs, cream whippers, cream chargers, dispensers, nitrous oxide whipped cream, and N2O tanks."
60,https://ssesgas.com/the-fastest-and-most-affordable-nitrous-oxide-cylinder-delivery-from-ssesgas-online-store-in-australia/,"[('where to buy nitrous oxide', 1), ('buy nitrous oxide', 0), ('buy nitrous oxide', 1)]",Fastest And Most Affordable Nitrous Oxide Cylinder,30 Jan 2023 — 
61,https://startwhip.com.au/collections/startwhip-max-3-3l-combo-cream-chargers,"[('nitrous oxide buy', 1), ('buy nitrous oxide canisters', 1), ('buy nitrous oxide', 1), ('nitrous oxide canisters for sale', 1), ('nitrous oxide for sale', 1), ('nitrous oxide canisters', 1)]",3.3L TANK CREAM CHARGERS COMBO,"Startwhip.com.au is an Australian online retailer selling 8G, 580G, 660G, 3.3XL Cream Chargers (N2O - Nitrous Oxide), Cream Whippers, and other related ..."
62,https://startwhip.com.au/collections/startwhip-max-3-3l-combo-cream-chargers?srsltid=AfmBOooB8ITQCEccDE9wGGfmTWDfpEjxOsNj2Ss6dKcMlgM9tJ2eChLY,"[('nitrous oxide canister', 0)]",3.3L TANK CREAM CHARGERS COMBO - Startwhip Max AU,"Startwhip.com.au is an Australian online retailer selling 8G, 580G, 660G, 3.3XL Cream Chargers (N2O - Nitrous Oxide), Cream Whippers, and other related ..."
63,https://startwhip.com.au/collections/startwhip-max-3-3l-combo-cream-chargers?srsltid=AfmBOop5IF3d9FnNyMkdCziyk75MFNlh9UTbihyeupCnYkGkdGyKwirT,"[('nitrous oxide for sale', 0)]",3.3L TANK CREAM CHARGERS COMBO - Startwhip Max AU,"Startwhip.com.au is an Australian online retailer selling 8G, 580G, 660G, 3.3XL Cream Chargers (N2O - Nitrous Oxide), Cream Whippers, and other related ..."
64,https://startwhip.com.au/collections/startwhip-max-3-3l-combo-cream-chargers?srsltid=AfmBOopK8tCeqk_6dmp4tNudXFdm84mg2Ix_DNeXJqaFSiJiXvMztdRT,"[('nitrous oxide tank', 0)]",3.3L TANK CREAM CHARGERS COMBO - Startwhip Max AU,"3.3L TANK CREAM CHARGERS COMBO ... Startwhip.com.au is an Australian online retailer selling 8G, 580G, 660G, 3.3XL Cream Chargers (N2O - Nitrous Oxide), Cream ..."
65,https://startwhip.com.au/collections/startwhip-max-3-3l-combo-cream-chargers?srsltid=AfmBOopT3Y-Dw1ygeIDyy-2HarMSIqAFHk1JacPluexMqvaKczhBn61Z,"[('nitrous oxide buy', 0)]",3.3L TANK CREAM CHARGERS COMBO - Startwhip Max AU,"Startwhip.com.au is an Australian online retailer selling 8G, 580G, 660G, 3.3XL Cream Chargers (N2O - Nitrous Oxide), Cream Whippers, and other related ..."
66,https://startwhip.com.au/collections/startwhip-max-3-3l-combo-cream-chargers?srsltid=AfmBOopxbrAyn2FTF75WaGhiAaqghnKfXTCIvPQQVJKjRGdtoRAJhAlc,"[('nitrous oxide tank', 1)]",3.3L TANK CREAM CHARGERS COMBO - Startwhip Max AU,"3.3L TANK CREAM CHARGERS COMBO ... Startwhip.com.au is an Australian online retailer selling 8G, 580G, 660G, 3.3XL Cream Chargers (N2O - Nitrous Oxide), Cream ..."
67,https://startwhip.com.au/collections/startwhip-max-3-3l-combo-cream-chargers?srsltid=AfmBOoqehsDTQO2BwvCeQHRrAQJslqVHeDxRq1sJogEZ45SOU6tX_mut,"[('nitrous oxide canisters for sale', 0)]",3.3L TANK CREAM CHARGERS COMBO,Startwhip Max carries N2O professional cream chargers and whipped cream whippers based in Melbourne. The only place where can buy whipped cream chargers.
68,https://startwhip.com.au/collections/startwhip-max-3-3l-combo-cream-chargers?srsltid=AfmBOorIHXmogB9jlS-4WdunDK12qjPJB_nmdUWF20GTkcbN4Ith_XhV,"[('nitrous oxide canisters', 0)]",3.3L TANK CREAM CHARGERS COMBO - Startwhip Max AU,"Cream Dispenser ... Startwhip.com.au is an Australian online retailer selling 8G, 580G, 660G, 3.3XL Cream Chargers (N2O - Nitrous Oxide), Cream Whippers, and ..."
69,https://startwhip.com.au/collections/startwhip-max-3-3l-combo-cream-chargers?srsltid=AfmBOorU2tJSQqn1e4AbwiflApjC1O3rHk34j7eE9bMZC0jGAHc7eHCr,"[('nitrous oxide canister', 1)]",3.3L TANK CREAM CHARGERS COMBO - Startwhip Max AU,"Startwhip.com.au is an Australian online retailer selling 8G, 580G, 660G, 3.3XL Cream Chargers (N2O - Nitrous Oxide), Cream Whippers, and other related ..."
